297	Τροίην θέσφατόν ἐστιν ἑλεῖν πόλιν ἔγχος Ἀχαιῶν·
298	εἰ δέ μιν ἁγνὸν ἄγαλμα λάβῃ νηοῖσιν Ἀθήνη,
299	φεύξονται προφυγόντες ἀνηνύστοις ἐπʼ ἀέθλοις.
300	ἀλλʼ ἄγε δὴ σειρῇσι περίπλοκον ἀμφιβαλόντες 
301	ἕλκετʼ ἐς ἀκρόπολιν μεγάλην χρυσήνιον ἵππον·
302	ἄμμι δʼ Ἀθηναίη ἐρυσίπτολις ἡγεμονεύοι
303	δαιδάλεον σπεύδουσα λαβεῖν ἀνάθημα καὶ αὐτή.
304	ὣς ἄρʼ ἔφη· καὶ τὸν μὲν ἄναξ ἐκέλευσε λαβόντα
305	ἕσσασθαι χλαῖνάν τε χιτῶνά τε, τοὶ δέ, βοείαις 
306	δησάμενοι σειρῇσιν, ἐυπλέκτοισι κάλωσιν
307	εἷλκον ὑπὲρ πεδίοιο, θοῶν ἐπιβήτορα κύκλων,
308	ἵππον ἀριστήεσσι βεβυσμένον· οἱ δὲ πάροιθεν
309	αὐλοὶ καὶ φόρμιγγες ὁμὴν ἐλίγαινον ἀοιδήν.
310	σχέτλιον ἀφραδέων μερόπων γένος, οἷσιν ὁμίχλη 
311	ἄσκοπος ἐσσομένων· κενεῷ δʼ ὑπὸ χάρματι πολλοὶ
312	πολλάκις ἀγνώσσουσι περιπταίοντες ὀλέθρῳ.
313	οἵη καὶ Τρώεσσι τότε φθισίμβροτος ἄτη
314	ἐς πόλιν αὐτοκέλευθος ἐκώμασεν· οὐδέ τις ἀνδρῶν
315	ᾔδεεν, οὕνεκα λάβρον ἐφέλκετο πένθος ἄλαστον. 
316	ἄνθεα δὲ δροσόεντος ἀμησάμενοι ποταμοῖο
317	ἔστεφον αὐχενίους πλοκάμους σφετέροιο φονῆος.
318	γαῖα δὲ χαλκείοισιν ἐρεικομένη περὶ κύκλοις
319	δεινὸν ὑπεβρυχᾶτο, σιδήρειοι δὲ διʼ αὐτῶν
320	τριβόμενοι τρηχεῖαν ἀνέστενον ἄξονες ἠχήν· 
321	τετρίγει δὲ κάλων ξυνοχή, καὶ πᾶσα ταθεῖσα
322	λιγνὺν αἰθαλόεσσαν ἕλιξ ἀνεκήκιε σειρή.
323	πολλὴ δʼ ἑλκόντων ἐνοπὴ καὶ κόμπος ὀρώρει·
324	ἔβρεμε νυμφαίῃσιν ἅμα δρυσὶ δάσκιος Ἴδη,
325	ἴαχε καὶ Ξάνθου ποταμοῦ κυκλούμενον ὕδωρ, 
326	καὶ στόμα κεκλήγει Σιμοείσιον· οὐρανίη δὲ
327	ἐκ Διὸς ἑλκόμενον πόλεμον μαντεύετο σάλπιγξ.
328	οἱ δʼ ἦγον προπάροιθεν· ὁδὸς δʼ ἐβαρύνετο μακρὴ
329	σχιζομένη ποταμοῖσι καὶ οὐ πεδίοισιν ὁμοίη.
330	εἵπετο δʼ αἰόλος ἵππος ἀρηιφίλους ἐπὶ βωμοὺς 
331	κυδιόων ὑπέροπλα, βίην δʼ ἐπέρεισεν Ἀθήνη
332	χεῖρας ἐπιβρίσασα νεογλυφέων ἐπὶ μηρῶν.
333	ὧδε θέων ἀκίχητος ἐπέδραμε θᾶσσον ὀιστοῦ
334	Τρῶας ἐυσκάρθμοισιν ὁδοιπορίῃσι διώκων,
335	εἰσόκε δὴ πυλέων ἐπεβήσατο Δαρδανιάων. 
336	αἱ δέ οἱ ἐρχομένῳ θυρέων πτύχες ἐστείνοντο·
337	ἀλλʼ Ἥρη μὲν ἔλυσεν ἐπὶ δρόμον αὖθις ὁδοῖο
338	πρόσθεν ἀναστέλλουσα, Ποσειδάων δʼ ἀπὸ πύργων
339	σταθμὸν ἀνοιγομένων πυλέων ἀνέκοπτε τριαίνῃ.
340	Τρωιάδες δὲ γυναῖκες ἀνὰ πτόλιν ἄλλοθεν ἄλλαι, 
341	νύμφαι τε πρόγαμοί τε καὶ ἴδμονες Εἰλειθυίης,
342	μολπῇ τʼ ὀρχηθμῷ τε περὶ βρέτας εἱλίσσοντο·
343	ἄλλαι δὲ χνοόωσαν ἀμελγόεναι χάριν ὄμβρου
344	ὁλκῷ δουρατέῳ ῥοδέους στορέσαντο τάπητας.
345	αἱ δὲ θαλασσαίης ἐπιμάζια νήματα μίτρης 
346	λυσάμεναι κλωστοῖσι κατέπλεκον ἄνθεσιν ἵππον.
347	καί τις ἀπειρεσίοιο πίθου κρήδεμνον ἀνεῖσα
348	χρυσείῳ προχέουσα κρόκῳ κεκερασμένον οἶνον
349	γαῖαν ἀνεκνίσσωσε χυτὴν εὐώδεϊ πηλῷ.
350	ἀνδρομέῃ δὲ βοῇ συνεβάλλετο θῆλυς ἰωή, 
351	καὶ παίδων ἀλαλητὸς ἐμίσγετο γήραος ἠχῇ.
352	οἷαι δʼ ἀφνειοῖο μετήλυδες Ὠκεανοῖο,
353	χείματος ἀμφίπολοι, γεράνων στίχες ἠεροφώνων,
354	κύκλον ἐπογμεύουσιν ἀλήμονος ὀρχηθμοῖο
355	γειοπόνοις ἀρότῃσιν ἀπεχθέα κεκληγυῖαι· 
356	ὣς οἵγε κλαγγῇ τε διʼ ἄστεος ἠδὲ κυδοιμῷ
357	ἦγον ἐς ἀκρόπολιν βεβαρημένον ἔνδοθεν ἵππον.
358	κούρη δὲ Πριάμοιο θεήλατος οὐκέτι μίμνειν
359	ἤθελεν ἐν θαλάμοισι· διαρρήξασα δʼ ὀχῆας
360	ἔδραμεν ἠύτε πόρτις ἀήσυρος, ἥντε τυπεῖσαν 
361	κέντρον ἀνεπτοίησε βοορραίσταο μύωπος·
362	ἡ δʼ οὐκ εἰς ἀγέλην ποτιδέρκεται οὐδὲ βοτῆρι
363	πείθεται οὐδὲ νομοῖο λιλαίεται, ἀλλὰ βελέμνῳ
364	ὀξέι θηγομένη βοέων ἐξήλυθε θεσμῶν·
365	τοίη μαντιπόλοιο βολῆς ὑπὸ νύγματι κούρη 
366	πλαζομένη κραδίην ἱερὴν ἀνεσείετο δάφνην.
367	πάντη δʼ ἐβρυχᾶτο κατὰ πτόλιν· οὐδὲ τοκήων
368	οὐδὲ φίλων ἀλέγιζε· λίπεν δέ ἑ παρθένος αἰδώς.
369	οὐχ οὕτω Θρήισσαν ἐνὶ δρυμοῖσι γυναῖκα
370	νήδυμος αὐλὸς ἔτυψεν ὀρειμανέος Διονύσου, 
371	ἥτε θεῷ πληγεῖσα παρήορον ὄμμα τιταίνει
372	γυμνὸν ἐπισσείουσα κάρη κυανάμπυκι κισσῷ,
373	ὡς ἥγε πτερόεντος ἀναΐξασα νόοιο
374	Κασσάνδρη θεόφοιτος ἐμαίνετο· πυκνὰ δὲ χαίτην
375	κοπτομένη καὶ στέρνον ἀνίαχε μαινάδι φωνῇ· 
376	ὦ μέλεοι, τίνα τοῦτον ἀνάρσιον ἵππον ἄγοντες
377	δαιμόνιοι μαίνεσθε καὶ ὑστατίην ἐπὶ νύκτα
378	σπεύδετε καὶ πολέμοιο πέρας καὶ νήγρετον ὕπνον;
379	δυσμενέων ὅδε κῶμος ἀρήιος· αἱ δέ που ἤδη
380	τίκτουσιν μογερῆς Ἑκάβης ὠδῖνες ὀνείρων, 
381	λήγει δʼ ἀμβολιεργὸν ἔτος πολέμοιο λυθέντος.
382	τοῖος ἀριστήων λόχος ἔρχεται, οὓς ἐπὶ χάρμην
383	τεύχεσιν ἀστράπτοντας ἀμαυροτάτην ὑπὸ νύκτα
384	τέξεται ὄβριμος ἵππος· ἐπὶ χθόνα δʼ ἄρτι θορόντες
385	ἐς μόθον ὁρμήσουσι τελειότατοι πολεμισταί. 
386	οὐ γὰρ ἐπʼ ὠδίνεσσι μογοστόκον ἵππον ἀνεῖσαι
387	ἀνδράσι τικτομένοισιν ἐπισχήσουσι γυναῖκες,
388	αὐτὴ δʼ Εἰλείθυια γενήσεται, ἥ μιν ἔτευξε·
389	γαστέρα δὲ πλήθουσαν ἀνακλίνασα βοήσει
390	μαῖα πολυκλαύτοιο τόκου πτολίπορθος Ἀθήνη. 
391	καὶ δὴ πορφύρεον μὲν ἑλίσσεται ἔνδοθι πύργων
392	αἵματος ἐκχυμένου πέλαγος καὶ κῦμα φόνοιο,
393	δεσμά τε συμπαθέων πλέκεται περὶ χερσὶ γυναικῶν
394	νυμφία, φωλεύει δʼ ὑπὸ δούρασι κευθόμενον πῦρ.
395	ὤμοι ἐμῶν ἀχέων, ὤμοι σέο, πάτριον ἄστυ, 
396	αὐτίκα λεπταλέη κόνις ἔσσεαι, οἴχεται ἔργον
397	ἀθανάτων, προθέλυμνα θεμείλια Λαομέδοντος.
398	καὶ σέ, πάτερ, καὶ μῆτερ, ὀδύρομαι, οἷά μοι ἤδη
399	ἀμφότεροι πείσεσθε· σὺ μέν, πάτερ, οἰκτρὰ δεδουπὼς
400	κείσεαι Ἑρκείοιο Διὸς μεγάλου παρὰ βωμῷ· 
401	μῆτερ ἀριστοτόκεια, σὲ δὲ βροτέης ἀπὸ μορφῆς
402	λυσσαλέην ἐπὶ παισὶ θεοὶ κύνα ποιήσουσι.
403	δῖα Πολυξείνη, σὲ δὲ πατρίδος ἐγγύθι γαίης
404	κεκλιμένην ὀλίγον δακρύσομαι· ὡς ὄφελέν τις
405	Ἀργείων ἐπὶ σοῖσι γόοις ὀλέσαι με καὶ αὐτήν. 
406	τίς γάρ μοι χρειὼ βιότου πλέον, εἴ με φυλάσσει
407	οἰκτροτάτῳ θανάτῳ, ξείνη δέ με γαῖα καλύψει;
408	τοιάδε μοι δέσποινα καὶ αὐτῷ δῶρον ἄνακτι
409	ἀντὶ τόσων καμάτων Ἀγαμέμνονι πότμον ὑφαίνει.
410	ἀλλʼ ἤδη φράζεσθε—τὰ δὲ γνώσεσθε παθόντες— 
411	καὶ νεφέλην ἀπόθεσθε, φίλοι, βλαψίφρονος ἄτης.
412	ῥηγνύσθω πελέκεσσι δέμας πολυχανδέος ἵππου
413	ἢ πυρὶ καιέσθω· δολόεντα δὲ σώματα κεῦθον
414	ὀλλύσθω, μεγάλη δὲ ποθὴ Δαναοῖσι γενέσθω.
415	καὶ τότε μοι δαίνυσθε καὶ ἐς χορὸν ὀτρύνεσθε
416	στησάμενοι κρητῆρας ἐλευθερίης ἐρατεινῆς.
417	ἡ μὲν ἔφη· τῇ δʼ οὔτις ἐπείθετο· τὴν γὰρ Ἀπόλλων
418	ἀμφότερον μάντιν τʼ ἀγαθὴν καὶ ἄπιστον ἔθηκεν.
419	τὴν δὲ πατὴρ ἐνένιπεν ὁμοκλήσας ἐπέεσσι·
420	τίς σε πάλιν, κακόμαντι, δυσώνυμος ἤγαγε δαίμων,
421	θαρσαλέη κυνόμυια; μάτην ὑλάουσʼ ἀπερύκεις.
422	οὔπω σοι κέκμηκε νόος λυσσώδεϊ νούσῳ,
423	οὐδὲ παλιμφήμων ἐκορέσσαο λαβροσυνάων;
424	ἀλλὰ καὶ ἡμετέρῃσιν ἐπαχνυμένη θαλίῃσιν
425	ἤλυθες, ὁππότε πᾶσιν ἐλεύθερον ἦμαρ ἀνῆψεν
426	ἡμῖν Ζεὺς Κρονίδης, ἐκέδασσε δὲ νῆας Ἀχαιῶν.
427	οὐδʼ ἔτι δούρατα μακρὰ τινάσσεται, οὐδʼ ἔτι τόξα
428	ἕλκεται, οὐ ξιφέων σελαγή, σιγῶσι δʼ ὀιστοί,
429	ἀλλὰ χοροὶ καὶ μοῦσα μελίπνοος, οὐδʼ ἔτι νείκη,
430	οὐ μήτηρ ἐπὶ παιδὶ κινύρεται, οὐδʼ ἐπὶ δῆριν
431	ἄνδρα γυνὴ πέμψασα νέκυν δακρύσατο χήρη·
432	ἵππον ἀνελκόμενον δέχεται πολιοῦχος Ἀθήνη.
433	παρθένε τολμήεσσα, σὺ δὲ πρὸ δόμοιο θοροῦσα
434	ψεύδεα θεσπίζουσα καὶ ἄγρια μαργαίνουσα
435	μοχθίζεις ἀτέλεστα καὶ ἱερὸν ἄστυ μιαίνεις.
436	ἔρρʼ οὕτως· ἡμῖν δὲ χοροὶ θαλίαι τε μέλονται.
437	οὐ γὰρ ἔτι Τροίης ὑπὸ τείχεσι δεῖμα λέλειπται,
438	οὐδʼ ἔτι μαντιπόλοιο τεῆς κεχρήμεθα φωνῆς.
439	ὣς εἰπὼν ἐκέλευσεν ἄγειν ἑτερόφρονα κούρην
440	κεύθων ἐν θαλάμοισι· μόγις δʼ ἀέκουσα τοκῆι
441	πείθετο, παρθενίῳ δὲ περὶ κλιντῆρι πεσοῦσα
442	κλαῖεν ἐπισταμένη τὸν ἑὸν μόρον· ἔβλεπε δʼ ἤδη
443	πατρίδος αἰθομένης ἐπὶ τείχεσι μαρνάμενον πῦρ.
444	οἱ δὲ πολισσούχοιο θεῆς ὑπὸ νηὸν Ἀθήνης
445	ἵππον ἀναστήσαντες ἐυξέστων ἐπὶ βάθρων
446	ἔφλεγον ἱερὰ καλὰ πολυκνίσσων ἐπὶ βωμῶν·
447	ἀθάνατοι δʼ ἀνένευον ἀνηνύστους ἑκατόμβας.
448	εἰλαπίνη δʼ ἐπίδημος ἔην καὶ ἀμήχανος ὕβρις,
449	ὕβρις ἐλαφρίζουσα μέθην λυσήνορος οἴνου.
450	ἀφραδίῃ τε βέβυστο, μεθημοσύνῃ τε κεχήνει
451	πᾶσα πόλις, πυλέων δʼ ὀλίγοις φυλάκεσσι μεμήλει·
452	ἤδη γὰρ καὶ φέγγος ἐδύετο, δαιμονίη δὲ
453	Ἴλιον αἰπεινὴν ὀλεσίπτολις ἀμφέβαλεν νύξ.
454	Ἀργείῃ δʼ Ἑλένῃ πολιὸν δέμας ἀσκήσασα
455	ἦλθε δολοφρονέουσα πολυφράδμων Ἀφροδίτη, 
456	ἐκ δὲ καλεσσαμένη προσέφη πειθήμονι φωνῇ·
457	νύμφα φίλη, καλέει σε πόσις Μενέλαος ἀγήνωρ
458	ἵππῳ δουρατέῳ κεκαλυμμένος, ἀμφὶ δʼ Ἀχαιῶν
459	ἡγεμόνες λοχόωσι τεῶν μνηστῆρες ἀέθλων.
460	ἀλλʼ ἴθι, μηδʼ ἔτι τοι μελέτω Πριάμοιο γέροντος 
461	μήτʼ ἄλλων Τρώων μήτʼ αὐτοῦ Δηιφόβοιο·
462	ἤδη γάρ σε δίδωμι πολυτλήτῳ Μενελάῳ.
463	ὣς φαμένη θεὸς αὖθις ἀνέδραμεν· ἡ δὲ δόλοισι
464	θελγομένη κραδίην θάλαμον λίπε κηώεντα,
465	καί οἱ Δηίφοβος πόσις εἴπετο· τὴν δὲ κιοῦσαν 
466	Τρῳάδες ἑλκεχίτωνες ἐθηήσαντο γυναῖκες.
467	ἡ δʼ ὁπόθʼ ὑψιμέλαθρον ἐς ἱερὸν ἦλθεν Ἀθήνης,
468	ἔστη παπταίνουσα φυὴν εὐήνορος ἵππου.
469	τρὶς δὲ περιστείχουσα καὶ Ἀργείους ἐρέθουσα
470	πάσας ἠυκόμους ἀλόχους ὀνόμαζεν Ἀχαιῶν 
471	φωνῇ λεπταλέῃ· τοὶ δʼ ἔνδοθι θυμὸν ἄμυσσον
472	ἀλγεινοὶ κατέχοντες ἐεργμένα δάκρυα σιγῇ.
473	ἔστενε μὲν Μενέλαος, ἐπεὶ κλύε Τυνδαρεώνης,
474	κλαῖε δὲ Τυδείδης μεμνημένος Αἰγιαλείης,
475	οὔνομα δʼ ἐπτοίησεν Ὀδυσσέα Πηνελοπείης, 
476	Ἄντικλος δʼ ὅτε κέντρον ἐδέξατο Λαοδαμείης,
477	μοῦνος ἀμοιβαίην ἀνεβάλλετο γῆρυν ἀνοίξας·
478	ἀλλʼ Ὀδυσεὺς κατέπαλτο καὶ ἀμφοτέρῃς παλάμῃσιν
479	ἀμφιπεσὼν ἐπίεζεν ἐπειγόμενον στόμα λῦσαι.
480	μάστακα δʼ ἀρρήκτοισιν ἀλυκτοπέδῃσι μεμαρπὼς 
481	εἶχεν ἐπικρατέως· ὁ δʼ ἐπάλλετο χερσὶ πιεσθείς,
482	φεύγων ἀνδροφόνοιο πελώρια δεσμὰ σιωπῆς.
483	καὶ τὸν μὲν λίπεν ἆσθμα φερέσβιον· οἱ δέ μιν ἄλλοι
484	δάκρυσι λαθριδίοισι κατακλαύσαντες Ἀχαιοὶ
485	κοῖλον ἀποκρύψαντες ἐς ἰσχίον ἔνθεσαν ἵππου 
486	καὶ χλαῖναν μελέεσσιν ἐπὶ ψυχροῖσι βαλόντες.
487	καί νύ κεν ἄλλον ἔθελγε γυνὴ δολόμητις Ἀχαιῶν,
488	εἰ μή οἱ βλοσυρῶπις ἀπʼ αἰθέρος ἀντήσασα
489	Παλλὰς ἐπηπείλησε, φίλου δʼ ἐξήγαγε νηοῦ
490	μούνῃ φαινομένη, στερεῇ δʼ ἀπεπέμψατο φωνῇ· 
491	δειλαίη, τέο μέχρις ἀλιτροσύναι σε φέρουσι
492	καὶ πόθος ἀλλοτρίων λεχέων καὶ Κύπριδος ἄτη;
493	οὔποτε δʼ οἰκτείρεις πρότερον πόσιν οὐδὲ θύγατρα
494	Ἑρμιόνην ποθέεις; ἔτι δὲ Τρώεσσιν ἀρήγεις;
495	χάζεο καὶ θαλάμων ὑπερώιον εἰσαναβᾶσα 
496	σὺν πυρὶ μειλιχίῳ ποτιδέχνυσο νῆας Ἀχαιῶν.
497	ὣς φαμένη κενεὴν ἀπάτην ἐκέδασσε γυναικός.
498	καὶ τὴν μὲν θαλαμόνδε πόδες φέρον· οἱ δὲ χοροῖο
499	παυσάμενοι καμάτῳ ἀδδηκότες ἤριπον ὕπνῳ.
500	καὶ δή που φόρμιγξ ἀνεπαύσατο, κεῖτο δὲ κάμνων 
501	αὐλὸς ἐπὶ κρητῆρι, κύπελλα δὲ πολλὰ χυθέντα
502	αὐτομάτως ῥείεσκε καθελκομένων ἀπὸ χειρῶν.
503	ἡσυχίη δὲ πόλιν κατεβόσκετο, νυκτὸς ἑταίρη,
504	οὐδʼ ὑλακὴ σκυλάκων ἠκούετο, πᾶσα δὲ σιγὴ
505	εἱστήκει καλέουσα φόνον πνείουσαν ἀυτήν. 
506	ἤδη δὲ Τρώεσσιν ὀλέθριον εἷλκε τάλαντον
507	Ζεὺς ταμίης πολέμοιο, μόγις μόλις F δʼ ἐλέλιξεν Ἀχαιούς·
508	χάζετο δʼ Ἰλιόθεν Λυκίης ἐπὶ πίονα νηὸν
509	ἀχνύμενος μεγάλοις ἐπὶ τείχεσι Φοῖβος Ἀπάλλων.
510	αὐτίκα δ Ἀργείοισιν Ἀχιλλῆος παρὰ τύμβον 
511	ἀγγελίην ἀνάφαινε Σίνων εὐφεγγέι δαλῷ
512	παννυχίη δʼ ἑτάροισιν ὑπὲρ θαλάμοιο καὶ αὐτὴ
513	εὐειδής Ἑλένη χρυσέην ἐπεδείκνυτο πεύκην.
514	ὡς δʼ ὁπότε πλήθουσα πυρὸς γλαυκοῖο σελήνη
515	οὐρανὸν αἰγλήεντα κατεχρύσωσε προσώπῳ· 
516	οὐχ ὅτε που γλωχῖνας ἀποξύνουσα κεραίης
517	πρωτοφαὴς ὑπὸ μηνὸς ἀνίσταται ἄσκιον ἀχλύν,
518	ἀλλʼ ὅτε κυκλώσασα περίτροχον ὄμματος αὐγὴν
519	ἀντιτύπους ἀκτῖνας ἐφέλκεται ἠελίοιο·
520	τοίη μαρμαίρουσα Θεραπναίη τότε νύμφη 
521	οἴνοπα πῆχυν ἀνεῖλκε, φίλου πυρὸς ἡνιοχῆα.
522	οἱ δὲ σέλας πυρσοῖο μετήορον ἀθρήσαντες
523	νῆας ἀνεκρούσαντο παλιγγνάμπτοισι κελεύθοις
524	Ἀργεῖοι σπεύδοντες, ἅπας δʼ ἠπείγετο ναύτης
525	δηναιοῦ πολέμοιο τέλος διζήμενος εὑρεῖν. 
526	οἱ δʼ αὐτοὶ πλωτῆρες ἔσαν κρατεροί τε μαχηταὶ
527	ἀλλήλοις τʼ ἐκέλευον ἐλαυνέμεν· αἱ δʼ ἄρα νῆες
528	ὠκύτεραι κραιπνῶν ἀνέμων ἀνέμων ταχυπειθέι ῥιπῇ
529	Ἴλιον εἰσανάγοντο Ποσειδάωνος ἀρωγῇ.
530	ἐνθάδε δὴ πεζοί πρότεροι κίον, οἱ δʼ ἐπέλειφθεν 
531	ἱππῆες κατόπισθεν, ὅπως μὴ Τρώιον ἵπποι
532	λαὸν ἀναστήσωσιν ἀειρομένῳ χρεμετισμῷ.
533	οἱ δʼ ἕτεροι γλαφυρῆς ἀπὸ γαστέρος ἔρρεον ἵππου,
534	τευχησταὶ βασιλῆες, ἀπὸ δρυὸς οἶα μέλισσαι,
535	αἵτʼ ἐπεὶ οὖν ἔκαμον πολυχανδέος ἔνδοθι σίμβλου 
536	κηρὸν ὑφαίνουσαι μελιηδέα ποικιλοτέχναι,
537	ἐς νομὸν εὐγυάλοιο κατʼ ἄγγεος ἀμφιχυθεῖσαι
538	νύγμασι πημαίνουσι παραστείχοντας ὁδίτας·
539	ὣς Δαναοὶ κρυφίοιο λόχου κληῖδας ἀνέντες
540	θρῷσκον ἐπὶ Τρώεσσι καὶ εἰσέτι κοῖτον ἔχοντας 
541	χαλκείου θανάτοιο κακοῖς ἐκάλυψαν ὀνείροις.
542	νήχετο δʼ αἵματι γαῖα, βοὴ δʼ ἄλληκτος ὀρώρει
543	Τρώων φευγόντων, ἐστείνετο δʼ Ἴλιος ἱρὴ
544	πιπτόντων νεκύων, οἱ δʼ ἀνδροφόνῳ κολοσυρτῷ
545	ἔζεον om. F; ἔζεον Rhodoman. ἔνθα καὶ ἔνθα μεμηνότες οἶα λέοντες 
546	σώμασιν ἀρτιφάτοισι γεφυρώσαντες ἀγυιάς.
547	Τρωιάδες δὲ γυναῖκες ὑπέρ τεγέων ἀίουσαι
548	αἱ μὲν ἐλευθερίης ἐρατῆς ἔτι διψώουσαι
549	αὐχένας ἐς θάνατον δειλοῖς ὑπέβαλλον ἀκοίταις,
550	αἱ δὲ φίλοις ἐπὶ παισί, χελιδόνες οἷάτε κοῦφαι, 
551	μητέρες ὠδύροντο· νέη δέ τις ἀσπαίροντα
552	ἠίθεον κλαύσασα θανεῖν ἔσπευδε καὶ αὐτὴ
553	οὐδὲ δορυκτήτοισιν ὁμοῦ δεσμοῖσιν ἕπεσθαι
554	ἤθελεν, ἀλλʼ ἐχόλωσε καὶ οὐκ ἐθέλοντα φονῆα
555	καὶ ξυνὸν λέχος ἔσχεν ὀφειλόμενον παρακοίτῃ. 
556	πολλαὶ δʼ ἠλιτόμηνα καὶ ἄπνοα τέκνα φέρουσαι
557	γαστέρος ὠμοτόκοιο χύδην ὠδῖνα μεθεῖσαι
558	ῥιγεδανῶς σὺν παισὶν ἀπεψύχοντο καὶ αὐταί.
559	παννυχίη δʼ ἐχόρευσεν ἀνὰ πτόλιν, οἷα θύελλα,
560	κύμασι παφλάζουσα πολυφλοίσβου πολέμοιο 
561	αἵματος ἀκρήτοιο μέθης ἐπίκωμος Ἐνυώ.
562	σὺν δʼ Ἔρις οὐρανόμηκες ἀναστήσασα κάρηνον
563	Ἀργείους ὀρόθυνεν, ἐπεὶ καὶ φοίνιος Ἄρης
564	ὀψὲ μὲν ἀλλὰ καὶ ὣς πολέμων ἑτεραλκέα νίκην
565	ἦλθε φέρων Δαναοῖσι καὶ ἀλλοπρόσαλλον ἀρωγήν. 
566	ἴαχε δὲ γλαυκῶπις ἐπʼ ἀκροπόληος Ἀθήνη
567	αἰγίδα κινήσασα, Διὸς σάκος, ἔτρεμε δʼ αἰθὴρ
568	Ἥρης σπερχομένης, ἐπὶ δʼ ἔβραχε γαῖα βαρεῖα
569	παλλομένη τριόδοντι Ποσειδάωνος ἀκωκῇ,
570	ἔφριξεν δʼ Ἀίδης, χθονίων δʼ ἐξέδρακε θώκων 
571	ταρβήσας, μή πού τι Διὸς μέγα χωσαμένοιο
572	πᾶν γένος ἀνθρώπων κατάγοι ψυχοστόλος Ἑρμῆς.
573	πάντα δʼ ὁμοῦ κεκύκητο, φόνος δέ τις ἄκριτος ἦεν·
574	τοὺς μὲν γὰρ φεύγοντας ἐπὶ Σκαιῇσι πύλῃσι
575	κτεῖνον ἐφεστηῶτες, ὁ δʼ ἐξ εὐνῆς ἀνορούσας 
576	τεύχεα μαστεύων δνοφερῇ περικάππεσεν αἰχμῇ.
577	καί τις ὑπὸ σκιόεντι δόμῳ κεκρυμμένος ἀνήρ,
578	ξεῖνος ἐών, ἐκάλεσσεν ὀιόμενος φίλον εἶναι·
579	νήπιος, οὐ μὲν ἔμελλεν ἐνηέι φωτὶ μιγῆναι,
580	ξείνια δʼ ἐχθρὰ κόμισσεν· ὑπέρ τέγεος δέ τις ἄλλος 
581	μήπω παπταίνων τι θοῷ διέπιπτεν ὀιστῷ.
582	καί τινες ἀλγεινῷ κραδίην βεβαρηότες οἴνῳ,
583	ἐκπλαγέες ποτὶ δοῦπον, ἐπειγόμενοι καταβῆναι,
584	κλίμακος ἐξελάθοντο καθʼ ὑψηλῶν τε μελάθρων
585	ἔκπεσον ἀγνώσσοντες, ἐπαυχενίους δὲ λυθέντες 
586	ἀστραγάλους ἐάγησαν, ὁμοῦ δʼ ἐξήρυγον οἶνον.
587	πολλοὶ δʼ εἰς ἕνα χῶρον ἀολλέες ἐκτείνοντο
588	μαρνάμενοι, πολλοὶ δὲ διωκόμενοι κατὰ πύργων
589	ἤριπον εἰς Ἀίδαο πανύστατον ἅλμα θορόντες.
590	παῦροι δὲ στεινῆς διὰ κοιλάδος, οἷάτε φῶρες, 
