591	πατρίδος ὀλλυμένης ἔλαθον χειμῶνα φυγόντες.
592	οἱ δʼ ἔνδον πολέμῳ τε καὶ ἀχλύι κυμαίνοντες,
593	ἀνδράσιν οἰχομένοισι καὶ οὐ φεύγουσιν ὁμοῖοι,
594	πίπτον ἐπʼ ἀλλήλοισι· πόλις δʼ οὐ χάνδανε λύθρον
595	ἀνδρῶν χηρεύουσα, περιπλήθουσα δὲ νεκρῶν. 
596	οὐδέ τι φειδωλή τις ἐγίνετο· φοιταλέῃ δὲ
597	σπερχόμενοι μάστιγι φιλαγρύπνοιο κυδοιμοῦ
598	οὐδὲ θεῶν ὄπιν εἶχον, ἀθεσμοτάτης δʼ ὑπὸ ῥιπῆς
599	ἀθανάτων ἔχραινον ἀπενθέας αἵματι βωμούς.
600	οἰκτρότατοι δὲ γέροντες ἀτιμοτάτοισι φόνοισιν 
601	οὐδʼ ὀρθοὶ κτείνοντο, χαμαὶ δʼ ἱκετήσια γυῖα
602	τεινάμενοι πολιοῖσι κατεκλίνοντο καρήνοις.
603	πολλὰ δὲ νήπια τέκνα μινυνθαδίων ἀπὸ μαζῶν
604	μητέρος ἡρπάζοντο καὶ οὐ νοέοντα τοκήων
605	ἀμπλακίας ἀπέτινον, ἀνημέλκτου δὲ γάλακτος 
606	παιδὶ μάτην ὀρέγουσα χοὰς ἐκόμισσε τιθήνη.
607	οἰωνοί τε κύνες τε κατὰ πτόλιν ἄλλοθεν ἄλλοι,
608	ἠέριοι πεζοί τε συνέστιοι εἰλαπινασταί,
609	αἷμα μέλαν πίνοντες ἀμείλιχον εἶχον ἐδωδήν,
610	καὶ τῶν μὲν κλαγγὴ φόνον ἔπνεεν, οἱ δʼ ὑλάοντες 
611	ἄγρια κοπτομένοισιν ἐπʼ ἀνδράσιν ὠρύοντο,
612	νηλέες, οὐδʼ ἀλέγιζον ἑοὺς ἐρύοντες ἄνακτας.
613	τὼ δὲ γυναιμανέος ποτὶ δώματα Δηιφόβοιο
614	στελλέσθην Ὀδυσσεύς τε καὶ εὐχαίτης Μενέλαος
615	καρχαλέοισι λύκοισιν ἐοικότες, οἵθʼ ὑπὸ νύκτα 
616	χειμερίην φονόωντες ἀσημάντοις ἐπὶ μήλοις
617	οἴχονται, κάματον δὲ κατατρύχουσι νομήων.
618	ἔνθα δύω περ ἐόντες ἀπειρεσίοισιν ἔμιχθεν
619	ἀνδράσι δυσμενέεσσι· νέη δʼ ἠγείρετο χάρμη
620	τῶν μὲν ἐπορνυμένων, τῶν δʼ ὑψόθεν ἐκ θαλάμοιο 
621	βαλλόντων λιθάκεσσι καὶ ὠκυμόροισιν ὀιστοῖς.
622	ἀλλὰ καὶ ὣς ὑπέροπλα καρήατα πυργώσαντες
623	ἀρρήκτοις κορύθεσσι καὶ ἀσπίσι κυκλώσαντες
624	εἰσέθορον μέγα δῶμα· καὶ ἀντίβιον μὲν ὅμιλον,
625	θῆρας δειμαλέους, ἐλάων ἐδάιξεν Ὀδυσσεύς, 
626	Ἀτρείδης δʼ ἑτέρωθεν ὑποπτήξαντα διώξας
627	Δηίφοβον κατέμαρψε, μέσην κατὰ γαστέρα τύψας
628	ἧπαρ ὀλισθηρῇσι συνεξέχεεν χολάδεσσιν.
629	ὣς ὁ μὲν αὐτόθι κεῖτο λελασμένος ἱπποσυνάων,
630	τῷ δʼ ἕπετο τρομέουσα δορυκτήτη παράκοιτις 
631	ἄλλοτε μὲν χαίρουσα κακῶν ἐπὶ τέρματι μόχθων,
632	ἄλλοτε δʼ αἰδομένη, τοτὲ δʼ ὀψέ περ ὡς ἐν ὀνείρῳ
633	λαθρίδιον στενάχουσα φίλης μιμνῄσκετο πάτρης.
634	Αἰακίδης δὲ γέροντα Νεοπτόλεμος βασιλῆα
635	πήμασι κεκμηῶτα παρʼ Ἑρκείῳ κτάνε βωμῷ 
636	οἶκτον ἀπωσάμενος πατρώιον· οὐδὲ λιτάων
637	ἔκλυεν, οὐ Πηλῆος ὁρώμενος ἥλικα χαίτην
638	ᾐδέσαθʼ, ἧς ὕπο θυμὸν ἀπέκλασεν ἠδὲ γέροντος
639	καίπερ ἐὼν βαρύμηνις ἐφείσατο τὸ πρὶν Ἀχιλλεύς.
640	σχέτλιος, ἦ μὲν ἔμελλε καὶ αὐτῷ πότμος ὁμοῖος 
641	ἑσπέσθαι παρὰ βωμὸν ἀληθέος Ἀπόλλωνος
642	ὕστερον, ὁππότε μιν ζαθέου δηλήμονα νηοῦ
643	Δελφὸς ἀνὴρ ἐλάσας ἱερῇ κατέπεφνε μαχαίρῃ.
644	ἡ δὲ κυβιστήσαντα διηερίων ἀπὸ πύργων—
645	χειρὸς Ὀδυσσείης ὀλοὸν βέλος—ἀθρήσασα 
646	Ἀνδρομάχη μινύωρον ἐκώκυεν Ἀστυάνακτα.
647	Κασσάνδρην δʼ ᾔσχυνεν Ὀιλῆος ταχὺς Αἴας
648	Παλλάδος ἀχράντοιο θεῆς ὑπὸ γοῦνα πεσοῦσαν·
649	ἡ δὲ βίην ἀνένευσε θεή, τὸ πρόσθεν ἀρηγὼν
650	ἀνθʼ ἑνὸς Ἀργείοισιν ἐχώσατο πᾶσιν Ἀθήνη. 
651	Αἰνείαν δʼ ἔκλεψε καὶ Ἀγχίσην Ἀφροδίτη
652	οἰκτείρουσα γέροντα καὶ υἱέα, τῆλε δὲ πάτρης
653	Αὐσονίην ἀπένασσε· θεῶν δʼ ἐτελείετο βουλὴ
654	Ζηνὸς ἐπαινήσαντος, ἵνα κράτος ἄφθιτον εἴη
655	παισὶ καὶ υἱωνοῖσιν ἀρηιφίλης Ἀφροδίτης. 
656	τέκνα δὲ καὶ γενεὴν Ἀντήνορος ἀντιθέοιο
657	Ἀτρείδης ἐφύλαξε, φιλοξείνοιο γέροντος,
658	μειλιχίης προτέρης τίνων χάριν ἠδὲ τραπέζης
659	κείνης, ᾗ μιν ἔδεκτο γυνὴ πρηεῖα Θεανώ.
660	δειλὴ Λαοδίκη, σὲ δὲ πατρίδος ἐγγύθι γαίης 
661	γαῖα περιπτύξασα κεχηνότι δέξατο κόλπῳ·
662	οὐδέ σε Θησείδης Ἀκάμας οὐδʼ ἄλλος Ἀχαιῶν
663	ἤγαγε ληιδίην, ἔθανες δʼ ἅμα πατρίδι γαίῃ.
664	πᾶσαν δʼ οὐκ ἂν ἔγωγε μόθου χύσιν ἀείσαιμι
665	κρινάμενος τὰ ἕκαστα καὶ ἄλγεα νυκτὸς ἐκείνης· 
666	Μουσάων ὅδε μόχθος, ἐγὼ δʼ ἅπερ ἵππον ἐλάσσω
667	τέρματος ἀμφιέλισσαν ἐπιψαύουσαν ἀοιδήν.
668	ἄρτι γὰρ ἀντολίηθεν ἀπόσσυτος Ὠκεανοῖο
669	ἠρέμα λευκαίνουσα κατέγραφεν ἠέρα πολλήν,
670	νύκτα διαρρήξασα μιαιφόνον ἱππότις Ἠώς· 
671	οἱ δʼ ἐπαγαλλόμενοι πολέμων ὑπεραυχέι νίκῃ
672	πάντοσε παπταίνεσκον ἀνὰ πτόλιν, εἴ τινες ἄλλοι
673	κλεπτόμενοι φεύγουσι φόνου πάνδημον ἀυτήν.
674	ἀλλʼ οἱ μὲν δέδμηντο λίνῳ θανάτοιο πανάγρῳ,
675	ἰχθύες ὡς ἁλίῃσιν ἐπὶ ψαμάθοισι χυθέντες, 
676	Ἀργεῖοι δʼ ἀπὸ μὲν μεγάρων νεοτευχέα κόσμον
677	ἐξέφερον, νηῶν ἀναθήματα, πολλὰ δʼ ἐρήμων
678	ἥρπαζον θαλάμων κειμήλια· σὺν δὲ γυναῖκας
679	ληιδίας σὺν παισὶν ἄγον ποτὶ νῆας ἀνάγκῃ.
680	τείχεσι δὲ πτολίπορθον ἐπὶ φλόγα θωρήξαντες 
681	ἔργα Ποσειδάωνος ἰῇ συνέχευον ἀυτμῇ.
682	αὐτοῦ καὶ μέγα σῆμα φίλοις ἀστοῖσιν ἐτύχθη
683	Ἴλιος αἰθαλόεσσα· πυρὸς δʼ ὀλεσίπτολιν ἄτην
684	Ξάνθος ἰδὼν ἔκλαυσε γόων ἁλιμυρέι πηγῇ,
685	Ἡφαίστῳ δʼ ὑπόεικεν ἀτυζόμενος χόλον Ἥρης. 
686	οἱ δὲ Πολυξείνης ἐπιτύμβιον αἷμα χέαντες,
687	υῆνιν ἱλασσάμενοι τεθνειότος Αἰακίδαο
688	Τρωιάδας τε γυναῖκας ἐλάγχανον, ἄλλα τε πάντα
689	χρυσὸν ἐμοιρήσαντο καὶ ἄργυρον· οἷσι βαθείας
690	νῆας ἐπαχθήσαντες ἐριγδούπου διὰ πόντου 
691	ἐκ Τροίης ἀνάγοντο μόθον τελέσαντες Ἀχαιοί.
